[
    {
        "ticket_id": "SIG-0001",
        "category": "Communications & Navigation",
        "priority": "P3",
        "assigned_team": "Deep Space Communications",
        "needs_escalation": false,
        "missing_information": [],
        "next_best_action": "Investigate subspace relay compatibility with the latest comm array firmware update. Check for known signal dropout issues during antenna switching on the port-side array. Verify relay module firmware v3.2 is the latest supported version.",
        "remediation_steps": [
            "Verify subspace relay module firmware v3.2 is the latest supported version",
            "Check for known signal dropout issues during antenna switching on the port-side array",
            "Test relay reconnection behavior after the latest comm array firmware update on a reference module",
            "If issue persists, escalate to Deep Space Communications for relay firmware patch review"
        ]
    },
    {
        "ticket_id": "SIG-0002",
        "category": "Flight Software & Instruments",
        "priority": "P3",
        "assigned_team": "Spacecraft Systems Engineering",
        "needs_escalation": false,
        "missing_information": [
            "software_version",
            "module_specs"
        ],
        "next_best_action": "Investigate whether flight console crash and navigation displaying old waypoints are related to the recent console swap migration. Verify that crew profile and instrument data were properly transferred to the new console.",
        "remediation_steps": [
            "Verify console provisioning and data migration completed successfully",
            "Clear flight console cache and reinitialize if crash persists",
            "Check navigation profile migration status and force waypoint cache resync",
            "Confirm instrument software versions match the supported standard flight image",
            "If issues persist after cache clear and resync, re-provision flight software on the new console"
        ]
    },
    {
        "ticket_id": "SIG-0003",
        "category": "Hull & Structural Systems",
        "priority": "P1",
        "assigned_team": "Spacecraft Systems Engineering",
        "needs_escalation": true,
        "missing_information": [
            "module_specs"
        ],
        "next_best_action": "Dispatch immediate on-site support to Command Briefing Room with a portable backup holographic display. Time-critical: $2.3M treaty delegation arriving in 25 minutes.",
        "remediation_steps": [
            "Dispatch technician to Command Briefing Room immediately",
            "Bring portable backup holographic display from engineering supply bay",
            "Check display power coupling, data conduit connections, and input source settings",
            "If main holographic display cannot be restored, set up portable unit before delegation arrives",
            "After briefing, schedule full diagnostic of the main Command Briefing Room display"
        ]
    },
    {
        "ticket_id": "SIG-0004",
        "category": "Crew Access & Biometrics",
        "priority": "P2",
        "assigned_team": "Spacecraft Systems Engineering",
        "needs_escalation": false,
        "missing_information": [
            "affected_subsystem",
            "anomaly_readout",
            "module_specs",
            "sequence_to_reproduce"
        ],
        "next_best_action": "Contact crew member to gather specifics: which subsystems are inaccessible, what anomaly readouts appear, what module they are using, and when the issue started. Cannot triage effectively without more detail.",
        "remediation_steps": [
            "Contact crew member to gather specific details about the issue",
            "Determine which subsystems and instruments are affected",
            "Check if the issue is isolated to this crew member or affecting others in their division",
            "Once root cause is identified, route to the appropriate specialist team"
        ]
    },
    {
        "ticket_id": "SIG-0005",
        "category": "Not a Mission Signal",
        "priority": "P4",
        "assigned_team": "None",
        "needs_escalation": false,
        "missing_information": [],
        "next_best_action": "Close — this is an automated cryo-sleep auto-reply to a maintenance notification, not a support request. No action required.",
        "remediation_steps": [
            "No action required — cryo-sleep auto-reply detected, close signal"
        ]
    },
    {
        "ticket_id": "SIG-0006",
        "category": "Threat Detection & Containment",
        "priority": "P2",
        "assigned_team": "Threat Response Command",
        "needs_escalation": true,
        "missing_information": [
            "stardate"
        ],
        "next_best_action": "Initiate threat containment investigation. Review authentication logs for unauthorized access from unknown sector, check data archive audit trail for document access from the suspicious coordinates, and verify that credential rotation and biometric re-verification are in effect.",
        "remediation_steps": [
            "Review authentication logs for the crew member's account over the past 48 hours",
            "Check data archive audit trail for any unauthorized file access or downloads from unknown sector",
            "Verify credential rotation was successful and biometric verification is active",
            "If unauthorized access is confirmed, escalate to Threat Response Command and notify data protection officer",
            "Brief crew member on interim security measures and monitor account for further anomalies"
        ]
    },
    {
        "ticket_id": "SIG-0007",
        "category": "Telemetry & Data Banks",
        "priority": "P2",
        "assigned_team": "Telemetry & Data Core",
        "needs_escalation": false,
        "missing_information": [],
        "next_best_action": "Check service credentials and RBAC role assignments on the primary data bank in telemetry-core-prod. Restore the Data Bank Contributor role if it was removed during the subsystem cleanup.",
        "remediation_steps": [
            "Verify service credential token expiration for the telemetry pipeline identity",
            "Check RBAC role assignments on the primary data bank in telemetry-core-prod",
            "Restore Data Bank Contributor role assignment if missing",
            "Re-run the telemetry pipeline 'prod-sensor-ingest' and verify successful execution",
            "Investigate why the role assignment was removed during the subsystem cleanup to prevent recurrence"
        ]
    },
    {
        "ticket_id": "SIG-0008",
        "category": "Telemetry & Data Banks",
        "priority": "P1",
        "assigned_team": "Telemetry & Data Core",
        "needs_escalation": true,
        "missing_information": [],
        "next_best_action": "Investigate telemetry core connection pool exhaustion immediately. This is a mission-critical incident — 40% of telemetry requests are failing regardless of the submitter's priority classification.",
        "remediation_steps": [
            "Investigate connection pool configuration on the primary telemetry core replica",
            "Identify and terminate long-running queries or leaked connections in the telemetry data banks",
            "Increase connection pool size or restart the primary telemetry core as immediate mitigation",
            "Verify secondary replica health and confirm it is handling redirected telemetry traffic",
            "Post-incident: conduct root cause analysis on telemetry core connection pool exhaustion"
        ]
    },
    {
        "ticket_id": "SIG-0009",
        "category": "Crew Access & Biometrics",
        "priority": "P3",
        "assigned_team": "Crew Identity & Airlock Control",
        "needs_escalation": true,
        "missing_information": [
            "previous_signal_id"
        ],
        "next_best_action": "Escalate airlock access issue for Habitat Ring 7 — third report without resolution. Verify airlock permissions in the updated access management system post-migration and cross-reference with SIG-2834 if accessible.",
        "remediation_steps": [
            "Check crew member's airlock permissions in the updated access management system",
            "Verify Habitat Ring 7 access rights were properly migrated from the old system",
            "If permissions appear correct, test the biometric scanner and airlock control panel",
            "Escalate to Crew Identity & Airlock Control if biometric scan and permissions are both confirmed working",
            "Follow up with crew member to confirm resolution"
        ]
    },
    {
        "ticket_id": "SIG-0010",
        "category": "Mission Briefing Request",
        "priority": "P3",
        "assigned_team": "Spacecraft Systems Engineering",
        "needs_escalation": false,
        "missing_information": [
            "crew_contact"
        ],
        "next_best_action": "Initiate new crew member provisioning workflow for Alex Rivera (arrival stardate March 31). Coordinate console, instrument software, access, and division membership provisioning across divisions. Target readiness by March 28.",
        "remediation_steps": [
            "Requisition standard flight console with sensor array from hardware procurement",
            "Prepare standard software image with navigation, telemetry, and analysis instruments",
            "Request analytics module workspace access (telemetry-ml-prod) from systems operations",
            "Request data catalog read access from Telemetry & Data Core",
            "Request Habitat Ring 3 airlock access from Crew Identity & Airlock Control",
            "Add Alex Rivera to the analytics division comm channel and crew manifest",
            "Schedule equipment handoff and station walkthrough for March 28"
        ]
    },
    {
        "ticket_id": "SIG-0011",